{
  "envelope_type": "env.dpp_export_v1",
  "verb": "transform",
  "id": "env-dpp-export-gs1-001",
  "time": "2025-12-09T10:00:00Z",
  "actor": {
    "role": "agent",
    "id": "dpp_lab_simulator"
  },
  "meta": {
    "domain": "dpp_lab",
    "labels": [
      "L2_02",
      "dpp_export_envelope",
      "gs1_epcis"
    ]
  },
  "roles": {
    "initiator": "manufacturer:ACME_BATTERY_GMBH",
    "transformer": "service:dpp_exporter_lab"
  },
  "data": {
    "passport_id": "BAT-2025-EXT-001",
    "target_format": "gs1_epcis",
    "options": {
      "regulation_profile": "EU_BATTERY_REG_2023",
      "include_traceability": true
    }
  }
}
